label,statement,speaker,context,justification
mostly-true,"In 1993, Newt Gingrich first advocated for the individual mandate in health care. And as recently as May of this year, he was still advocating for it.",michele-bachmann,"a Republican presidential debate in Des Moines, Iowa","In the 1993 interview, Gingrich advocated for individuals ""being required to have health insurance,"" though he expressed flexibility on the details. In the 2011 interview, Gingrich said ""we ought to have some requirement that you either have health insurance or you post a bond. ""Its an exaggeration to say that this equates to advocating for an individual mandate, since he posed it as one of two acceptable options."
barely-true,"Says as a result of the national health care reform, the Congressional Budget Office says we save $250 million over the first 10 years. Over the next 10 years, we save $1.2 trillion in savings in terms of health care.",robert-menendez,an interview on Richard French Live,"Over the next 10 years, we save $1. 2 trillion in savings in terms of health care. ""But Menendez fumbled by citing those specific figures. Over the first 10 years, the budget office is projecting a reduction of $210 billion, not the ""$250 million"" cited by Menendez. As for whether there will be ""$1. 2 trillion in savings"" in the second 10 years, the budget office has not projected any specific dollar figure for that period."
half-true,"You said you would vote against the Patriot Act, then you came to the Senate, you voted for it.",hillary-clinton,"a debate in Manchester, N.H.","Clinton was also among those senators voting yes. Obama said the final deal was not ideal but was an improvement over earlier Republican proposals. ""This compromise does modestly improve the Patriot Act by strengthening civil liberties protections without sacrificing the tools that law enforcement needs to keep us safe,"" he said, adding, ""I urge my colleagues to continue working on ways to improve the civil liberties protections in the Patriot Act after it is reauthorized. ""So while Obama did vote to reauthorize the Patriot Act, he did so after working to improve the law by expanding civil rights guarantees."
mostly-true,The federal minimum wage is worth about 20 percent less than it was when Ronald Reagan gave his first address to a joint session of Congress.,barack-obama,the State of the Union address,"Obama said, ""the federal minimum wage is worth about twenty percent less than it was when Ronald Reagan"" gave his first State of the Union address. Obama's not far off, but its actually closer to 16 percent less. And using Reagan to make a case to raise the minimum wage should be taken with a grain of salt since the former president never increased it during his two terms. And by Reagans last State of the Union, the minimum wage was $2 less than when he first took office, if you factor in inflation. We had written that Obama had said ""the federal minimum wage is worth about 20 percent less than it was when Ronald Reagan"" gave his first State of the Union address. As the reader pointed out, a new president's first address to a joint session of Congress -- the 1981 speech that Obama was referring to -- is not officially called a State of the Union address. So we have rewritten our paraphrase in the ruling statement above to remove the reference to the State of the Union."
FALSE,"A proposed tax to fund transportation projects would spend $90,000 to take a single vehicle off the road during the morning and afternoon commute.",steve-brown,a forum hosted by The Atlanta Journal-Constitution,"In sum:    Brown based his calculation on a transit cost estimate thats open to accusations of cherry-picking. Furthermore, even Brown and Ross think their own number falls short."
barely-true,A salesclerk at Hobby Lobby who needs contraception is not going to get that service through her employers health care plan because her employer doesnt think she should be using contraception.,hillary-clinton,an interview at the Aspen Ideas Festival,"Clinton said that ""a salesclerk at Hobby Lobby who needs contraception  is not going to get that service through her employers health care plan because her employer doesnt think she should be using contraception. ""Hobby Lobby doesnt shun contraception entirely for its employees; it pays for access to 16 out of the FDAs 20 approved methods. Where Clinton has a partial point is that an employee would be barred from having the company pay for four other types, even if one of those may be the best medical option for the employees needs. UPDATE, July 4, 2014: After this article was published, Hillary Clinton's camp got back to us. A spokesman pointed us to a line from Ginsberg's dissent that ""seems to be pretty in line with"" Clinton's comments. ""The exemption sought by Hobby Lobby and Conestoga (Wood Specialties, another plaintiff in the case) would override significant interests of the corporations employees and covered dependents. It would deny legions of women who do not hold their employers beliefs access to contraceptive coverage that the ACA would otherwise secure."
half-true,Says Charlie Crist voted against raising the minimum wage.,republican-party-florida,a campaign commercial,"The Republican Party of Florida said, ""Crist voted against raising the minimum wage. ""We should note that the vote in question was not the kind of vote people would usually think of when it comes to the minimum wage. Crist has never voted on legislation about the minimum wage in any official capacity. But Crist was at a 2004 meeting of a business advocacy group, and there was a unanimous voice vote expressing the organizations opinion against raising the minimum wage. Crist was at the meeting, but none of the votes were recorded."
barely-true,Hillary Clinton said gun confiscation would be worth considering.,national-rifle-association,a flier.,"The NRA says that when Clinton was asked about gun confiscation, she said ""I think it would be worth doing it on a national level, if that can be arranged. ""Clinton made that statement last year at a New Hampshire campaign stop, when she was asked a vague question about an Australian program that gave gun owners one year to sell certain firearms to the government before those weapons became illegal. She left the NRA some room. But the NRA stretches her words to an almost unrecognizable form. Clinton focused her comments on voluntary buyback programs similar to those some U. S.  communities have instituted for guns and the federal ""cash-for-clunkers"" program. She was ambiguous about how a U. S.  guns buyback program might be structured, saying ""I dont know enough details to tell you how we would do it or how it would work. ""And her campaign since has said she opposes gun confiscation."
mostly-true,"Already, a prototype driverless car has traveled more than 300,000 miles in the crowded maze of California streets without a single accident.",jeb-bush,a speech at CPAC,"During his CPAC speech, Bush talked about technological innovations underway and that will occur over the next 100 years. ""Already, a prototype driverless car has traveled more than 300,000 miles in the crowded maze of California streets without a single accident,"" Bush said. We dont fault Bush for citing the 300,000 figure rather than the recent 500,000 figure, because that higher number only received publicity after the CPAC speech. ""We found two accidents, but they both had mitigating factors. One car was rear ended, which suggests another driver was at fault. In another accident, a human was operating the car, at least according to Google. Still, we couldnt find one incident where a driverless car operating under its own technology clearly caused an accident."
half-true,"Last year, out of the 500,000 (in) population growth we had in the state of Texas, about 250,000 of the 500,000 came to Texas... from the other 49 states.",david-dewhurst,his inaugural address.,"First, the census data for 2010 hasnt been released yet. And the most generous census estimate prior to last year indicates net migration from other states equaled 143,000 people from July 2008 to July 2009, accounting for less than a third of the states population increase in the period. However, looking at Texas population growth in terms of people moving here ""with their feet"" versus people born here, Dewhurst pegged the ratio correctly -- about half-and-half."
FALSE,When undocumented children are picked up at the border and told to appear later in court ... 90 percent do not then show up.,jeff-flake,"an interview on the PBS ""News Hour""","Flake said that when undocumented children are picked up at the border and ""told to appear later in court . . . 90 percent do not then show up. ""Historically, the rate has ranged between 20 percent to 40 percent, settling in at about 30 percent in 2012, the most recent full year for which data is available. A more recent estimate for children specifically, made by the director of the office responsible for handling such cases, is that the current no-show rate for children is 46 percent. Thats still quite high, but its only half what Flake said."
half-true,Says Gov. Chris Christie cut spending (by) $1 billion and provided $850 million in new education funding.,committee-our-childrens-future,a television ad,"Given the cuts made last year, education funding has gone up by a total of about $30 million since Christies first budget in office."
mostly-true,Hes the only candidate whos balanced budgets and brought jobs to Providence.,steven-costantino,a TV commercial ,"He said he voted in favor of the tax benefits that lured the GTECH headquarters to the capital city. He also supported a variety of ordinances needed for development of the Rhode Island Convention Center. Finally, he told us he added a handful of jobs to the Providence City Council office."
half-true,"Studies have shown that in the absence of federal reproductive health funds, we are going to see the level of abortion in Georgia increase by about 44 percent.",hank-johnson,an article published in The Atlanta Journal-Constitution,"In fact, he cited a single study from a widely respected group. While scholars have found that in general, increases in the use of contraceptives lead to decreases in abortion, and one expert said Guttmacher may have underestimated its Georgia figures, we found no other study that confirms or refutes its conclusions about this state. Johnson would have been right if he said that studies show contraception decreases abortion, and that without Title X funds, abortions could rise."
pants-fire,ACORN will be a paid partner with the Census Bureau and they will be in charge of going door-to-door and collecting data from the American public.,michele-bachmann,an interview with the Washington Times.,So we have to set the meter on fire once again.
pants-fire,Sixty percent of the Hispanics support the Arizona immigration law,russell-pearce,a CNN interview,"On the national level, anywhere from 54 to 70 percent have either a strongly or somewhat unfavorable view of the legislation. On the state level, 70 percent strongly disagree with the law and 11 percent somewhat disagree."
barely-true,"If the sequester hits, federal prosecutors will have to let criminals go.",barack-obama,"a speech in Washington, D.C. ","Obama said that, if the sequester hits, ""federal prosecutors will have to close cases and let criminals go. ""Its clear that U. S.  Attorneys offices are looking at a potential cut of $101 million, and a reduction of that size would almost certainly cut back on prosecutions in some fashion. However, the impacts are not as clear-cut as Obamas bold language suggests. Officials will have a fair amount of discretion in prioritizing what types of cases prosecutors will pursue, possibly cutting back on civil cases rather than criminal ones. And the cuts taking place in U. S.  Attorney's offices wouldn't directly affect ""criminals"" at all, but rather suspects and targets of prosecution who haven't had their guilt determined yet."
barely-true,Says Dick Cheney de-Baathisized the Iraqi government and created ISIS.,chris-matthews,a broadcast on MSNBC,"Matthews said Cheney de-Baathisized the Iraqi government and created ISIS. We find that Cheney played a key role in de-Baathification and in creating the circumstances thatled to the formation of ISIS. Former Baathists provide important military ISIS leadership, as they did in the first few years after the invasion when they joined forces with the group that preceded ISIS, al-Qaida in Iraq. However, many of those same Baathists later turned against al-Qaida in Iraq. They shifted back into the orbit of what became ISIS due to the repressive policies under Iraqi Prime Minister Maliki. The causal link is too distant to say Cheney created ISIS. His decisions contributed to the groups formation, but not more than that."
TRUE,Says Bill and Hillary Clinton attended Donald Trumps last wedding.,carlos-curbelo,a radio interview,"Curbelo said Bill and Hillary Clinton were at Donald Trump's last wedding. Bill Clinton only made the reception, but Hillary Clinton did have a seat in the first row at the church in 2005. Both rubbed elbows with the stars at the reception."
FALSE,I did not play any role in bringing the company to RI as did others in government. I was tasked with handling the legislation affecting the company by my superiors.,steven-costantino,a statement,"In his defense, Costantino issued a statement in which he said: ""I did not play any role in bringing the company to RI as did others in government. I was tasked with handling the legislation affecting the company by my superiors. ""In other words: Dont blame me, I was just doing my job. But the records and comments of people involved illustrate that Costantino played a key part in Rhode Island's courtship of 38 Studios. The legislation he helped pass, offering valuable loan guarantees, was his idea, according to one former EDC official. During the process, Costantino shielded his idea from the type of full political scrutiny that might have killed it. He did this by not naming 38 Studios on the House floor when he was asked who was pushing for the loan-guarantee program. When the deal was done, the CEO of Schilling's company thanked all members of the General Assembly and singled out five elected officials by name, including the former House Finance Committee chairman. Costantino played a pivotal role in creating the 38 Studios mess. In some ways, the record shows he bears as much responsibility as the other elected government officials who ""tasked"" him."
half-true,"Obamacare insurance cooperative failures should be expected because theyre like any business, and when you start businesses in America, at the fifth year, half of the businesses have closed.",ezekiel-emanuel,"a discussion on MSNBC's ""Up with Steve Kornacki""","Emanuel said the Obamacare insurance co-ops failed at a rate thats typical for American businesses over a five-year period. The underlying comparison is flawed. While the age of each co-op is subject to debate, we used the Census Bureaus definition to determine when they were born. Interviews with experts, government audits, and regulators actions point to three years as the typical lifespan of a failed co-op. About 50 percent of the co-ops shut down. Compared to the three-year failure rate in America, the co-ops have done much worse -- cratering at a rate that is about 40 percent faster than average. But Emanuel could turn out to be right. We wont know the five-year rate for the entire group until late in 2016 or early 2017. If the remaining co-ops are still running, then the groups failure rate will be close to the national average. Emanuels statement is accurate regarding the five-year-average but leaves out important details."
FALSE,The tax cut deal is giving $700 billion to millionaires and billionaires.,sherrod-brown,a CNN interview,"Yet by the time Brown appeared on CNN (three days after the administration announced the compromise), the deal was for two years, and it was that very deal that Brown went on the air to criticize. Even if the deal had been for 10 years, Brown misapplied the cost figure by describing the whole $700 billion as going to millionaires and billionaires. Joint Committee projections from earlier this year estimated that cost would be more like $327 billion over 10 years. Those are two key points on which Browns statement simply is not accurate."
mostly-true,Says Marco Rubio said Social Security and Medicare haveweakened us as a people.,patrick-murphy,a Florida Senate debate,"Murphy said that Rubio ""said Social Security and Medicare have weakened us as a people,' "" he said. In a speech in 2011, Rubio talked about government programs intended to help people and said, ""These programs actually weakened us as a people. ""Rubio argued that people no longer had to worry about saving once they viewed it as the governments job and that the government supplanted the role of families and religious institutions to help people in need."
mostly-true,"Across the country, $174 billion of the Recovery Act have been committed in its first 130 days.",joe-biden,a news release.,He said that $174 billion had been committed at the 130-day mark. Federal records show he was a little off. The administration's Recovery. gov site shows that $157. 8 billion had been committed.
TRUE,"As secretary of the Department of Energy under former President Bill Clinton, ""I created reserves of home heating oil.""",bill-richardson,"a debate in Manchester, N.H.","None came close to today's price. Did that reserve lower prices?That's unclear, since the reserve remains today, even though  as Richardson himself points out  heating oil prices in New Hampshire are ""the highest ever."
TRUE,Twenty-five states have lower unemployment than Texas which is tied with Mississippi for more minimum-wage jobs than anywhere in the United States.,lloyd-doggett,an interview with ABC TV.,"Washington, which has a state minimum wage rate higher than the federal rate, had the lowest share of hourly workers paid at or below minimum wage, 1. 1 percent. In sheer numbers, Texas had 268,000 hourly workers earning minimum wage and 282,000 paid below the minimum wage, the bureau says, the most of any state by a wide margin. Almost 13 percent of the nations hourly workers paid at or below the minimum wage were in Texas, the second most-populous state with more than 25 million residents, or about 8 percent of the nations population, according to the U. S.  Census Bureau. Mississippi, with almost 3 million residents, had 34,000 and 29,000 hourly workers, respectively, earning the minimum wage or less."
half-true,"Of the 20 bills [Rep. David] Cicilline has sponsored in his three years in office, not a single one has advanced past the embryonic committee stage.",ian-prior,a Providence Journal commentary,"Ian Prior said, ""of the 20 bills [Rep.  David] Cicilline has sponsored in his three years in office, not a single one has advanced past the embryonic committee stage. ""In addition, 4 of the 10 amendments Cicilline offered passed. Priors point is that legislators in a minority party have no influence."
half-true,"Says Donald Trump has said he loves war, including with nukes.",priorities-usa-action,"an ad discussed on ""Meet the Press""","An ad by Priorities USA says Trump says he loves war, ""including with nukes. ""Trump did say the phrase ""I love war in a certain way. ""And Trump has said he wouldn't rule out using nuclear weapons. But that doesnt mean he is enthusiastic about them. He says they would be the weapon of last resort and that he believes nuclear proliferation to be the ""biggest problem, to me, in the world. ""It's worth noting that the Trump comment used in the ad wasnt about the United States using nuclear weapons, but about his belief that Japan might be better off if it had nuclear weapons. Readers can decide for themselves if Trumps positions are dangerous."
barely-true,"Any state tax law has to start in the House and the renewal of the state hospital bed tax this year started in the Senate, which is unconstitutional.",david-pennington,a public meeting,"The mayor and gubernatorial candidate is correct that tax laws must begin in the House of Representatives. But because the bill called for a state agency -- and not lawmakers -- to levy the fee, a legislative law opinion deemed the approval process acceptable. Also, challenges to the bills constitutionality would be difficult because the Georgia Supreme Court has not overturned legislation that has been duly passed by both houses and signed into law. Pennington and others may not agree with the process, or how the hospital levy is classified, but the law appears not to be on their side."
mostly-true,"Every child born today inherits a $30,000 share in a national debt that stands at more than $13 trillion.",tim-pawlenty,"his book, ""Courage to Stand: An American Story""","On Jan.  1, 2011, gross federal debt stood at just over $14 trillion, which works out to $45,433 for every American. So both of the figures Pawlenty used have a basis in reality, but they do not relate to each other the way he suggested. If Pawlenty wants to stick with the $30,000-per-person figure, he should have said that debt stands at more than $9 trillion. Alternately, if he prefers to stick with the ""more than $13 trillion"" debt figure, he should say that the amount of debt per person exceeds $45,000."
FALSE,A strong bipartisan majority in the House of Representatives voted to defund Obamacare.,ted-cruz,a news release,"Cruz said that ""a strong bipartisan majority"" in the House of Representatives ""voted to defund Obamacare. ""Even if you consider the overall 230-189 margin to be a ""strong"" victory for backers of the measure, it doesnt qualify as ""bipartisan"" except in the most hyper-technical sense. Two Democrats out of the 190 who voted -- barely more than 1 percent of the partys caucus -- joined Republicans in voting for the bill. In our book, that doesnt qualify as much of a bipartisan action."
half-true,Proximity to high-voltage power lines lowers property values by as much as 30 percent.,friends-india-point-park,a web site,"Riley says that language was chosen on purpose. (Theres also some question about what the group means by ""proximity) but we wont get into that here."
FALSE,What the facts say is ...the best scenario for kids is a loving mom and dad.,reince-priebus,"comments on ""Meet the Press""","Priebus said, ""What the facts say"" is . . . ""the best scenario for kids is a loving mom and dad,"" as opposed to having same-sex parents. And overall, scholarly research shows that what matters to children is the quality and stability of the parenting, rather than the parents particular sex, gender or sexual orientation."
FALSE,Says Mark Neumann = Nancy Pelosi,scott-walker,campaign TV and radio ads,"Using Walkers logic, Walker could have linked himself to Pelosi. After all, he supported a provision in the bill at the time. Walker wouldnt agree with that comparison. And we dont agree with the Neumann-Pelosi one."
half-true,"To hear Gov. Christie tell it, everything in New Jersey is going just fine. Well I see another New Jersey with 400,000 unemployed. One of the worst jobless rates in the country. Working and middle class families have seen costs soar, from property taxes to college tuition.",barbara-buono,a gubernatorial campaign television ad,"Christie tell it, everything in New Jersey is going just fine. Well I see another New Jersey with 400,000 unemployed. One of the worst jobless rates in the country. Working and middle class families have seen costs soar, from property taxes to college tuition. ""Buono is right that nearly 400,000 New Jerseyans are out of work, but fewer people are unemployed now than when Christie became governor. Also, the state is faring better in job creation when employment gains are analyzed across the bulk of Christies time in office. Still, the governors aid cuts in 2010 to help close budget gaps resulted in higher tuition at two-year and four-year schools in the state."
barely-true,Says delegates cant legally change the Republican National Convention rules to prevent Donald Trumps nomination.,donald-trump,"an interview on ""Meet the Press""","Trump said delegates seeking to change the convention rules to prevent his nomination ""cant do it legally. ""Under current rules, the delegates are bound to vote for whomever won their states primary or caucus (in most cases, Trump). But if this years rules committee votes to change the rules to thwart Trump, its well within its authority to do so. And intervention by the courts would be unlikely. Because political parties are private organizations, courts have said they can set their own rules."
pants-fire,Rebuilding three high schools will benefit 40 percent of Portland Public School students.,carole-smith,a press briefing,"But we dont agree with the way Smith reached her number, by using clusters, and we dont think Lincoln should be included when none of Lincoln will be rebuilt by the proposed bond measure. The school districts own projections show enrollment at the three rebuilt high schools will make up only a quarter of all high school students."
half-true,Proposition 2 on Novembers Texas ballot does not cost state taxpayers any money.,H204TEXAS-PAC,an email blast.,"She added that the proposal ""does not encumber any state funds. ""And while the additional bond authority sought in the proposition would not cost state taxpayers--up front--state lawmakers could still exploit their standing authority, as before, to spend state revenue on related debt."
