label,statement,speaker,context,justification
TRUE,Providence has the lowest crime rate in three decades.,david-cicilline,a debate,"For example, Cicilline is talking about the crime rate when the number his administration is using is the total number of crime reports, which is different. But when we looked closely, we found that those issues didn't actually affect the conclusion. For a discussion of those factors, CLICK HERE."
FALSE,On banning earmarks.,bill-nelson,Senate floor votes,"Going forward Sen.  Nelson will keep looking for ways to cut spending, while also fighting to make sure Florida gets its fair share of federal funding for things like ports, military bases and major projects that bring new jobs. ""Without a formal ban, Nelson -- who is up for reelection in 2012 -- is free to continue to pursue earmarks. But his Nov.  30 vote is an about-face from an earlier vote and his comments to reporters."
half-true,Says hes taken an 8% pay decrease in each of the nine years he has been in office.,gerald-daugherty,his campaign website,"Daugherty says on his campaign site that hes ""taken an 8% pay decrease in each of the nine years he has been in office. ""As a commissioner, Daugherty took a pay cut once. In fiscal 2004, his salary went down 1. 55 percent to $66,523. Daugherty also hasconsistently taken steps to ensure hes paid 8 percent less than fellow commissioners each year, though in one year his pay ran about 6 percent behind."
half-true,1 percent of Americans are millionaires. 47 percent of House Reps. are millionaires. 56 percent of Senators are millionaires.,facebook-posts,Facebook,"The Facebook posting from Occupy D. C.  said, ""1 percent of Americans are millionaires. 47 percent of House Reps.  are millionaires. 56 percent of Senators are millionaires. ""One recent study found that around 9 percent of all U. S.  households have net assets of more than $1 million. It's closer if you look only at income. The top 1 percent of Americans has an average income of $1. 5 million. But the relevant figure would be net worth. As for members of Congress, the most recent estimate shows that 42 percent of House members and 67 percent of senators are millionaires in net worth. That means the Facebook post is a bit high in its estimate of House millionaires and a bit low in its estimate of Senate millionaires. The numbers support the underlying point of the Facebook post -- that members of Congress are disproportionately wealthy. But not on the scale suggested."
barely-true,The decision for the United States to buy heavy water from Iran will directly subsidize Irans nuclear program.,paul-ryan,a news release,"Heavy water, which can be used to make a nuclear weapon, clearly is part of Irans nuclear program. And by reducing Irans heavy water stockpile, the purchase helps Iran comply with a nuclear agreement that is aimed at making it harder for the country to develop a nuclear weapon."
mostly-true,The Texas Department of Transportation... misplaced a billion dollars.,debra-medina,a debate.,The money never existed in the first place. But she didn't miss the point.
FALSE,A judges order means theres a Constitution exemption zone if you live within 100 miles of the United States border.,facebook-posts,a Facebook post,"A Facebook post said a judge's order means there's a ""Constitution exemption zone"" if you live ""within 100 miles of the United States border. ""There is a border search exception, which long predates the district court ruling, that allows officials at or near borders to search people and their possessions without obtaining warrants. Experts say thats not an exception to the whole Fourth Amendment. It's certainly not an exemption to the entire Constitution, which covers a wide range of rights, like freedom of the press and freedom of religion."
TRUE,"Pepper ... kicked off a jock tax, imposing a levy on the sports and entertainment industry.",dave-yost,a campaign video,"The story did not mention Pepper or the city of Cincinnati. However, Peppers legislation, while beneficial to the city budget, did institute the tax collection in Cincinnati. And the experts we talked to said collecting the tax was the citys prerogative. Pepper cant duck responsibility for starting the tax in Cincinnati."
barely-true,"Mitch McConnell opposed ""legislation to create and protect Kentucky jobs . . . help for the unemployed. . . health care for Kentucky's children,"" and ""fair pay for women.""",democratic-national-committee,a television ad,"Actually, McConnell said he supported all of those values, but he didn't agree with Democratic methods for achieving them."
TRUE,"Under Mayor Tom Barrett, the number of Milwaukee police officers has not increased.",bob-donovan,an interview,"The mayor will propose his 2015 budget in September. Our rating Donovan said the number of Milwaukee police officers ""has not increased"" under Mayor Tom Barrett. And other measuring sticks offered by Barretts office show the same trend."
barely-true,Taxpayers subsidize 80 percent of each MARTA trip,brett-bittner,an interview,"I didnt use the ancillary figures in the budget,"" he said. ""Were still subsidizing over half as taxpayers, especially those of us who live and work in Fulton and DeKalb. ""In rebuttal, Harris points out every mode of transportation  including road building  is subsidized by taxes to some extent. That argument aside, Bittner was significantly off in assigning 80 percent of the costs of a MARTA trip to the taxpayer, even if he stands by the larger point."
pants-fire,"President Obama, Sen. Harry Reid and Rep. Nancy Pelosi passed a $1.2 trillion stimulus bill.",george-allen,,"It roughly equals the total 13-year expenses of Virginias state government between 1999 and 2012. Allen is not only exaggerating the spending total by President Obama and the Democratic leaders of Congress, he is doing it by including billions of dollars passed under a Republican president. So we have to set the meter ablaze."
TRUE,Says Milken Institute rated San Antonio as nations top-performing local economy.,julian-castro,his speech at the Texas Democratic Party State Convention in Houston,"San Antonio hasnt just been holding steady in the economic downturn; its been gaining ground, even compared to other Texas cities."
pants-fire,Says people in Africa literally walk two and three hundred miles in order to vote.,mike-bennett,comments made on the Senate floor.,"None of the African elections officials we spoke with heard of any case of someone walking 200 to 300 miles to vote. In fact, they wanted to know where Bennett got his information from. We searched news accounts of the recent elections in Chad, Uganda, Nigeria and elsewhere and found no instance of people walking hundreds of miles in order to vote."
TRUE,"Before World War II, very few people actually had health insurance.",james-carr,an interview,"Carr said before World War II, very few people had health insurance. While Carr doesnt take into account the advances in medical care over the past 75 years, hes right. Only about 10 percent of the U. S.  population had private health insurance then, generally from an employer-based system."
FALSE,Half of children struck by cars near schools are hit by parents driving children to school.,safe-routes-schools,a mailer,Were not suggesting that proponents of safer roads have trumped up a figure to champion a cause.
barely-true,"Citizens Property Insurance has over $500 billion worth of risk, with less than $10 billion worth of surplus.",rick-scott,comments to the press,"Scott has said repeatedly that Citizens has more than $500 billion worth of risk, but about $6 billion in cash surplus. But the $500-billion number vastly overstates what Citizens might have to pay in even the most vicious storm season imaginable. So those numbers are not the appropriate figures to use when determining whether the insurer ""is going to be able to pay the bill"" after a storm. Scotts statement ignores critical facts that would give a different impression."
barely-true,Tom Leppert pledged to make Dallas a sanctuary city for illegal immigrants.,conservative-renewal-pac,a TV ad.,"We were hampered by not being offered, or finding, the original described pledge. Still, Leppert''s camp confirmed that he at one time pledged respect for immigration enforcement being a federal issue. If so, our sense is that he acted in step with the police departments decade-old policy of leaving immigration-related inquiries to Uncle Sam -- which alone can be taken as sufficient to support the ""sanctuary city"" label. Then again, Leppert did not pledge to ""make"" Dallas into a sanctuary. His position was essentially status quo. Also, the county joined the Secure Communities program while he was mayor."
TRUE,Putting three Republicans in my Cabinet...is unprecedented.,barack-obama,a news conference,"It'd be one thing if Obama had appointed the Republican leader of the Senate to a high-level Cabinet position. That might move things toward some sort of reconciliation government, he said. ""But governing is way more sophisticated than these symbolic gestures. ""Whatever you make of the appointments, Obama is on solid ground when he said his three Republican Cabinet appointments were unprecedented."